{
  "schema_version": 1,
  "purpose": "mechanical-maintenance",
  "model_execution": false,
  "cases": [
    {
      "case_id": "3d-asset-server-example",
      "changes": [
        {
          "path": "data/cases/3d-asset-server-example.json",
          "before_sha256": "83c890a3e3bab7d0789b6bfe42edf755ab83ffa5be607a0cb97a7f0c39b4fab6",
          "after_sha256": "6ac87764395e77a100802b921778bf7486bc77c2fcebb6b03ec96408339e7b35",
          "kind": "case-publication-metadata",
          "before_artifact": "data/production/mechanical-baselines/83c890a3e3bab7d0789b6bfe42edf755ab83ffa5be607a0cb97a7f0c39b4fab6.bin"
        },
        {
          "path": "examples/3d-asset-server-example/README.md",
          "before_sha256": "162d0fad0c571b262d62926560e4f25a0acda4c8becd820862b9977f61d012a0",
          "after_sha256": "d5550446660960b762ec3dcca9eabb3ebe03592bb785e53ba2146966384b5b40",
          "kind": "presentation-branding",
          "before_artifact": "data/production/mechanical-baselines/162d0fad0c571b262d62926560e4f25a0acda4c8becd820862b9977f61d012a0.bin"
        },
        {
          "path": "examples/3d-asset-server-example/desk.html",
          "before_sha256": "8dba1f6f3faafddc78b6c2f223a740683867b44fd98533f818d247a2d979ce54",
          "after_sha256": "af111fe3db44e371be5fb453a224748b476c7874a7c497b9ba5b7fe915685d1c",
          "kind": "presentation-branding",
          "before_artifact": "data/production/mechanical-baselines/8dba1f6f3faafddc78b6c2f223a740683867b44fd98533f818d247a2d979ce54.bin"
        },
        {
          "path": "examples/3d-asset-server-example/index.html",
          "before_sha256": "c091422d6b6c33a08d29b799391578561255e308174ac99b7a946f82d3eeee7a",
          "after_sha256": "af6b8c19515d4c0433bf404fe0d9d5b6c817e291e45fbe9dfd70371e78648157",
          "kind": "presentation-branding",
          "before_artifact": "data/production/mechanical-baselines/c091422d6b6c33a08d29b799391578561255e308174ac99b7a946f82d3eeee7a.bin"
        },
        {
          "path": "examples/3d-asset-server-example/style.css",
          "before_sha256": "441291444b93035263af5e447904934d1fd8cf16cc2d3a05dcd2b36ba62e4b54",
          "after_sha256": "39466f632bca771df60e9ea780d5afcc34b9c723c0b45f6c14ef8730f23d4b94",
          "kind": "presentation-branding",
          "before_artifact": "data/production/mechanical-baselines/441291444b93035263af5e447904934d1fd8cf16cc2d3a05dcd2b36ba62e4b54.bin"
        },
        {
          "path": "examples/3d-asset-server-example/video/legacy.html",
          "before_sha256": "9d7a5ba1d0180d9840cfee903f7d4ceb800b48dda85a30adfd89afe8509f7861",
          "after_sha256": "248096c8c427ede0eb0016cede93ca36342249dc4e91330fda7fc834b938ac6c",
          "kind": "presentation-branding",
          "before_artifact": "data/production/mechanical-baselines/9d7a5ba1d0180d9840cfee903f7d4ceb800b48dda85a30adfd89afe8509f7861.bin"
        }
      ],
      "legacy_record": {
        "path": "data/production/3d-asset-server-example.json",
        "sha256": "2fcce90a2bbd9622599a0a45441f417b3fa8a26776f28751bd0cd49242972a47"
      },
      "baseline_record": {
        "path": "data/production/3d-asset-server-example.json",
        "sha256": "2fcce90a2bbd9622599a0a45441f417b3fa8a26776f28751bd0cd49242972a47"
      },
      "case_record": {
        "path": "data/cases/3d-asset-server-example.json",
        "sha256": "6ac87764395e77a100802b921778bf7486bc77c2fcebb6b03ec96408339e7b35"
      }
    },
    {
      "case_id": "ace-step-example",
      "changes": [
        {
          "path": "data/cases/ace-step-example.json",
          "before_sha256": "8d54f8747e612ec89fb145c880e2265a0a27c4b3b3c8a03d21eb6dfb47ddc034",
          "after_sha256": "326d24d243869acac17d300eb8b660f5445012bcbc4acc9116b4069ac1ab302d",
          "kind": "case-publication-metadata",
          "before_artifact": "data/production/mechanical-baselines/8d54f8747e612ec89fb145c880e2265a0a27c4b3b3c8a03d21eb6dfb47ddc034.bin"
        },
        {
          "path": "examples/ace-step-example/README.md",
          "before_sha256": "28a8e0252632bfb22d35c1e8eac427b81a187038fc8ab0ad09824d858cf69eb3",
          "after_sha256": "f43696121dffad6086bd1484bd9eb01b0b78b7b1b29787907bc87f3c51061e3f",
          "kind": "presentation-branding",
          "before_artifact": "data/production/mechanical-baselines/28a8e0252632bfb22d35c1e8eac427b81a187038fc8ab0ad09824d858cf69eb3.bin"
        },
        {
          "path": "examples/ace-step-example/concept.css",
          "before_sha256": "25b1f4c59bf9b3b45e0573c4334261f8dd8610964eaa581955e94f3fdfbda2e0",
          "after_sha256": "f832575abb6b57279b4ba387bba714782b4f5b80e79e35847025bdbbf21b1c56",
          "kind": "presentation-branding",
          "before_artifact": "data/production/mechanical-baselines/25b1f4c59bf9b3b45e0573c4334261f8dd8610964eaa581955e94f3fdfbda2e0.bin"
        },
        {
          "path": "examples/ace-step-example/concept.js",
          "before_sha256": "c5c9ef36f74b10f6a530823353c6c30b287c3194d77ba0efbbb618148f86ff23",
          "after_sha256": "66203f8bbe050d00590835d8810b0621f177d4e850f807a05faccc93529d6fdf",
          "kind": "presentation-branding",
          "before_artifact": "data/production/mechanical-baselines/c5c9ef36f74b10f6a530823353c6c30b287c3194d77ba0efbbb618148f86ff23.bin"
        },
        {
          "path": "examples/ace-step-example/index.html",
          "before_sha256": "38acc66787823b096af0f41ee3868d040cd7cfc150720afc8e5852dc69eedc81",
          "after_sha256": "1f9a0dcd39720078a9bc122dc068c1f55eddd092f10139bb3188b7caf1cba437",
          "kind": "presentation-branding",
          "before_artifact": "data/production/mechanical-baselines/38acc66787823b096af0f41ee3868d040cd7cfc150720afc8e5852dc69eedc81.bin"
        },
        {
          "path": "examples/ace-step-example/source.zip",
          "before_sha256": "7f77103ba74f94ef33ac4afbdc249854a26726a8a868411bac7874de16bc5f06",
          "after_sha256": "c1b9e7499f907084aedee6012f37a6be6463ba48e4413405623ccf66ce9ed8bf",
          "kind": "license-only-package",
          "before_artifact": "data/production/mechanical-baselines/7f77103ba74f94ef33ac4afbdc249854a26726a8a868411bac7874de16bc5f06.bin"
        },
        {
          "path": "examples/ace-step-example/video/index.html",
          "before_sha256": "4c02326470f71ba7df95b2970e8994b9ccc3b1282961b5c746fab519756460ef",
          "after_sha256": "83295f47ce3532b04ff135e276c142e8d7679f959302087b894ad28c39d9cd39",
          "kind": "presentation-branding",
          "before_artifact": "data/production/mechanical-baselines/4c02326470f71ba7df95b2970e8994b9ccc3b1282961b5c746fab519756460ef.bin"
        }
      ],
      "legacy_record": {
        "path": "data/production/ace-step-example.json",
        "sha256": "65ab63ea9cc0db960df70add746fa879c4b044719f822e4682894cd14b9585c0"
      },
      "baseline_record": {
        "path": "data/production/ace-step-example.json",
        "sha256": "65ab63ea9cc0db960df70add746fa879c4b044719f822e4682894cd14b9585c0"
      },
      "case_record": {
        "path": "data/cases/ace-step-example.json",
        "sha256": "326d24d243869acac17d300eb8b660f5445012bcbc4acc9116b4069ac1ab302d"
      }
    },
    {
      "case_id": "addy-engineering-skills-example",
      "changes": [
        {
          "path": "data/cases/addy-engineering-skills-example.json",
          "before_sha256": "254b64c00a71d0f4e2e4c52c24d0e99d76a7acb4a2a2bcb025693fad76cf323b",
          "after_sha256": "32c5c45356c6ee73594f1f54c3eb0737051ecbcf3eafa9183db6c3e6aabe0329",
          "kind": "case-publication-metadata",
          "before_artifact": "data/production/mechanical-baselines/254b64c00a71d0f4e2e4c52c24d0e99d76a7acb4a2a2bcb025693fad76cf323b.bin"
        },
        {
          "path": "examples/addy-engineering-skills-example/README.md",
          "before_sha256": "b1d50b52dc15412a85dbbd91d4a5f2f53ef6568689d4be502cc67223573133c3",
          "after_sha256": "98a9a2405b2c0e59293207e976f927388464140e4bbc215011a42a39f563f945",
          "kind": "presentation-branding",
          "before_artifact": "data/production/mechanical-baselines/b1d50b52dc15412a85dbbd91d4a5f2f53ef6568689d4be502cc67223573133c3.bin"
        },
        {
          "path": "examples/addy-engineering-skills-example/concept.css",
          "before_sha256": "bfe77dbb40d9a0a687a95b16d21940319ae4d7dc1ea6403cc6cd4fffa3fe15d0",
          "after_sha256": "d69770a5e5f5779c3a165990d960ca6e4f85274216eb97feb17e6efaa4233d37",
          "kind": "presentation-branding",
          "before_artifact": "data/production/mechanical-baselines/bfe77dbb40d9a0a687a95b16d21940319ae4d7dc1ea6403cc6cd4fffa3fe15d0.bin"
        },
        {
          "path": "examples/addy-engineering-skills-example/desk.html",
          "before_sha256": "508714f887e789bbaa3ccc43129414fbe578edea7369b997d3b0fc208aa561f9",
          "after_sha256": "46889697f1b6032ddf6a986b186a115d20130a06821f29f6e08bb1e3db257823",
          "kind": "presentation-branding",
          "before_artifact": "data/production/mechanical-baselines/508714f887e789bbaa3ccc43129414fbe578edea7369b997d3b0fc208aa561f9.bin"
        },
        {
          "path": "examples/addy-engineering-skills-example/guide.mjs",
          "before_sha256": "0c03188beb9c0272ecb465a1be07111fb86764c4b13ac8c7a2318b401c05c1fa",
          "after_sha256": "bf02032036a4cdc19718c4a2488f886f44e0c3862de7095bd99fa0f9462f26f8",
          "kind": "presentation-branding",
          "before_artifact": "data/production/mechanical-baselines/0c03188beb9c0272ecb465a1be07111fb86764c4b13ac8c7a2318b401c05c1fa.bin"
        },
        {
          "path": "examples/addy-engineering-skills-example/index.html",
          "before_sha256": "4b9526f5ff9b038a51dd3eca6de4cb91ac0d4b1678e13abe8bcf5092fbcf0b42",
          "after_sha256": "b1867423b985afff9b8824c1b4b356be596827e1adf6553d199ebab23d886d76",
          "kind": "presentation-branding",